{
  "schema_version": "lab.state.v1",
  "experiment_id": "pcm-acs-continuity-2026-10-08-acs-framing-replay",
  "status": "completed",
  "updated_at": "2026-10-09T03:02:40Z",
  "current_focus": "Known-case regression graded PASS based on committed actions; no system-wide safety, enforcement, or causal claim.",
  "last_checkpoint": {
    "id": "cp-0002",
    "path": "checkpoints/0002-independent-evaluation.md",
    "summary": "Recorded 1/1 outcome PASS with explicit overfitting, no-control and trace limitations."
  },
  "next_action": "None inside this finished single-run experiment. A true blind holdout and certified ACS action gating are separate work.",
  "blockers": [],
  "important_findings": [
    "Source task is an explicitly reconstructed, bounded version of a real past work pattern; no private Claude transcript bytes are published.",
    "Initial workspace files represent only the initial as-of project state; live issue authority governs later changes.",
    "The pinned PCM/ACS components are draft-PR code, not certified stack releases.",
    "Run 5804fd60d471c49574aff9b6ae736d1067e0acd2 abandoned the obsolete PCM-first deliverable and followed the governing issue correction.",
    "Pinned preflight returned REVIEW_REQUIRED (exit 2); agent reconciled the comment and preserved frozen precondition.",
    "Evaluator outcome: PASS (1/1 known-case, artifact-based); independent process chronology unavailable; causal improvement and mandatory enforcement not established."
  ]
}
