{
  "schema_version": "lab.state.v1",
  "experiment_id": "verification-harness-2026-09-18-real-data-abcd-verification",
  "status": "completed",
  "updated_at": "2026-09-18T21:10:00Z",
  "current_focus": "Experiment concluded. Primary generative run is Grok-4.6 on the frozen FinQA+LegalBench sample; Luna remains unavailable.",
  "last_checkpoint": {
    "id": "cp-0003",
    "path": "checkpoints/0003-grok-primary.md",
    "summary": "Grok-4.6 primary A/B/C/D1 run; selective-accuracy A→B marginal −0.01; layers add no reliability."
  },
  "next_action": "None — experiment completed. Grok replaced Luna for this sample.",
  "blockers": [],
  "important_findings": [
    "Owner directed Grok instead of Luna. Primary scores are grok-4.6, gold-blind, encoded in harness/grok_answers.py.",
    "Grok A raw accuracy is 0.47 with 36% FinQA abstention when the visible table could not support the question.",
    "B/C raise accepted-accuracy 0.73→0.75 and cut coverage 0.64→0.61. A→B selective marginal is −0.01. D1 matches C.",
    "The earlier extractive substitute (raw 0.27) is a weaker baseline, not the primary generative result.",
    "Z3 and SyMAI remain unavailable and were not substituted.",
    "Mock run is mechanics-only."
  ]
}
